{
  "review_id": "secondary_project_reviewer_RUN-1110101-CAL006-A",
  "run_id": "RUN-1110101-CAL006-A",
  "project_id": "1110101",
  "reviewer_role": "project_reviewer",
  "created_at": "2026-06-23T02:32:27Z",
  "independence": {
    "fresh_process": true,
    "external_transmission": false,
    "reference_access_after_freeze": true,
    "manual_repair": false
  },
  "validity": "PASS",
  "quality_score": 42,
  "scorable_coverage": 38,
  "confidence": "LOW",
  "rubric_dimension_scores": {
    "source_selection_provenance_conflict": 14,
    "panel_schedule_enclosure_facts": 5,
    "device_bom_quantity_tag_fidelity": 8,
    "shared_geometry_cross_pdf_consistency": 8,
    "production_drawing_quality": 3,
    "punch_drawing_quality": 2,
    "sheetmetal_drawing_quality": 2
  },
  "output_type_scores": {
    "production": 14,
    "sheetmetal": 14,
    "punch": 14
  },
  "critical_findings": 0,
  "high_findings": 3,
  "findings": [
    {
      "severity": "HIGH",
      "classification": "UNAVAILABLE_IN_ALLOWED_INPUT",
      "finding": "Exact enclosure and cutout dimensions were not available in the allowed sanitized bundle; generated drawings remain schematic/TBD.",
      "evidence_ids": [
        "grading_result.findings[1]",
        "comparison_metrics.pairings",
        "effective_sheet_revision_manifest.references"
      ]
    },
    {
      "severity": "HIGH",
      "classification": "UNAVAILABLE_IN_ALLOWED_INPUT",
      "finding": "Reference-specific layout decisions could not be scored as source-supported because completed references were unavailable to the generator.",
      "evidence_ids": [
        "grading_result.findings[2]",
        "comparison_metrics.pairings",
        "effective_sheet_revision_manifest.references"
      ]
    },
    {
      "severity": "HIGH",
      "classification": "DESIGN_CHOICE_WITH_CONSTRAINTS",
      "finding": "All three PDFs are internally consistent but minimal and not fabrication-ready.",
      "evidence_ids": [
        "grading_result.findings[3]",
        "comparison_metrics.pairings",
        "effective_sheet_revision_manifest.references"
      ]
    }
  ],
  "comparison_limitations": [
    "No exact geometry overlay was produced because registration was not established as reliable.",
    "Completed references are used only in reviewer workspace after generation freeze.",
    "Scoring separates unavailable dimensions from unsupported invented values."
  ],
  "run_metadata": {
    "generation_complete_sha256": "BE4294FBC38E780C8A26B19DAB0FF8FC7EAD21384DC7A7CFCABE5E210BF9B426",
    "freeze_manifest_sha256": "CEAD50B5D7CC2EC6D63A2F9B15081F0B09D08588CD1C4C8BDB210FAE27115F94",
    "comparison_metrics_sha256": "CD924F772A0F3BF9DF538718B6161970BE8C0A6DC3E68A77FC75DF0A9077F9AB",
    "grading_result_sha256": "8E5017F47CC5FC4AED9078ED1292F9CFD84B43781E6DADB54E07B308463206DC",
    "effective_manifest_sha256": "712802B522923E962849BBF4393D13B8630887C32581BF5F1F92F79C48024044",
    "freeze_hash": "9887F9283750D5A26D7B9DD4C9C77082B181D3FD20EAA332F8CF08B6339A2B98",
    "paired_outputs": [
      "production",
      "sheetmetal",
      "punch"
    ],
    "reference_count": 3,
    "reviewer_workspace": "C:\\Users\\alex1\\OneDrive\\Documents\\PLC Panels Generation Helper\\evals\\sandboxes\\RUN-1110101-CAL006-A\\reviewer_workspace",
    "rubric": "plc_layout_v1",
    "reviewer_label": "secondary_project_reviewer",
    "blind_note": "secondary reviewer blind to primary score, findings, generator identity, and portfolio statistics"
  }
}
